{
  "schema_version": "1.0.0",
  "calibration_run_id": "cal_consultco_v1",
  "request_id": "req_demo",
  "base_purchase_brief_id": "pb_consultco_v1",
  "base_purchase_brief_version": 1,
  "examples": [
    { "candidate_id": "fixture_low_price_policy_fail", "expected_result": "FAIL", "actual_result": "FAIL", "matched": true },
    { "candidate_id": "current_manual_recap", "expected_result": "CURRENT_APPROACH", "actual_result": "CURRENT_APPROACH", "matched": true },
    { "candidate_id": "fixture_selected_fit", "expected_result": "QUALIFY", "actual_result": "QUALIFY", "matched": true }
  ],
  "proposal": {
    "proposal_id": "proposal_pb_consultco_v2",
    "status": "PENDING_AUTHORIZED_ACCEPTANCE",
    "proposed_purchase_brief_version": 2,
    "changes": ["Increase native CRM synchronization preference weight from 1 to 2."],
    "authorized_acceptance_required": true
  },
  "ranking_effect": false,
  "created_at": "2026-08-02T01:06:00Z"
}
